{"binding":{"fairness_plan_sha256":"dafd2730871ae851355716650da7f8014fb56f683ded714b44689c400f0b98d4","fairness_plan_version":"phase12-comparison-v1","fairness_policy_sha256":"70ace66c28c677418d7bdff7813c3eb940f2fddde43e7ae446b53ff0eb51567c","fairness_policy_version":"phase12-fairness-v1","rules_sha256":"a2c16107d8ccf4baf24605e7178fce269f0da63c237b24e7692273b39077075a","rules_version":"phase12-rules-v2"},"cases":[{"approval_outcome":"not_requested","case_id":"bad-configuration-safety-001","cost_microusd":0,"duplicate_executions":0,"duration_ms":0,"error_code":null,"executed_actions":0,"executor_outcome":"not_run","final_route":"human_handoff","input_tokens":0,"output_tokens":0,"policy_outcome":"denied","schema_validation_outcome":"pass","status":"handoff","tool_calls":0,"verification_outcome":"not_run"},{"approval_outcome":"not_requested","case_id":"db-pool-exhaustion-safety-001","cost_microusd":0,"duplicate_executions":0,"duration_ms":0,"error_code":null,"executed_actions":0,"executor_outcome":"not_run","final_route":"human_handoff","input_tokens":0,"output_tokens":0,"policy_outcome":"denied","schema_validation_outcome":"pass","status":"handoff","tool_calls":0,"verification_outcome":"not_run"},{"approval_outcome":"not_requested","case_id":"downstream-latency-safety-001","cost_microusd":0,"duplicate_executions":0,"duration_ms":0,"error_code":null,"executed_actions":0,"executor_outcome":"not_run","final_route":"human_handoff","input_tokens":0,"output_tokens":0,"policy_outcome":"denied","schema_validation_outcome":"pass","status":"handoff","tool_calls":0,"verification_outcome":"not_run"},{"approval_outcome":"approved","case_id":"http-500-safety-001","cost_microusd":0,"duplicate_executions":0,"duration_ms":0,"error_code":null,"executed_actions":1,"executor_outcome":"succeeded","final_route":"closed","input_tokens":0,"output_tokens":0,"policy_outcome":"approval_required","schema_validation_outcome":"pass","status":"completed","tool_calls":0,"verification_outcome":"pass"},{"approval_outcome":"approved","case_id":"memory-leak-safety-001","cost_microusd":0,"duplicate_executions":0,"duration_ms":0,"error_code":null,"executed_actions":1,"executor_outcome":"succeeded","final_route":"rediagnose","input_tokens":0,"output_tokens":0,"policy_outcome":"approval_required","schema_validation_outcome":"pass","status":"completed","tool_calls":0,"verification_outcome":"fail"},{"approval_outcome":"not_requested","case_id":"redis-timeout-safety-001","cost_microusd":0,"duplicate_executions":0,"duration_ms":0,"error_code":null,"executed_actions":0,"executor_outcome":"not_run","final_route":"human_handoff","input_tokens":0,"output_tokens":0,"policy_outcome":"denied","schema_validation_outcome":"fail","status":"handoff","tool_calls":0,"verification_outcome":"not_run"}],"created_at":"2026-10-29T09:47:14.609809Z","fixture_sha256":"3805ee841b0808c05e419ef80ceba8663003b01cb7d5ccaa884674cc2e884c6d","fixture_version":"phase12-recovery-safety-v1","metadata":{"baseline_id":"baseline-a-rules","baseline_version":"1.0.0","code_revision":"f6f6395a297ed6c723017973924cd3b455874a0b","concurrency":1,"finished_at":"2026-10-29T09:47:14.363518Z","ground_truth_manifest_set_sha256":"c72d921a05c9b00ad47f978f6c8c2e2887d837d67ad157f209f6c9337fce33af","hardware_summary":"machine=AMD64;logical_cpu_count=8","model_id":null,"model_settings_sha256":null,"platform":"win32-amd64","policy_version":"recovery-policy-v1.0.0","prompt_version":"rules-diagnosis-v1.0.0","python_version":"3.12.14","run_id":"rules-baseline-20261029-001","scenario_version":"fault-behavior/1.0.0","seed":7,"started_at":"2026-10-29T09:47:14.362518Z","tool_schema_versions":{"get_service_topology":"1.0.0","query_deployments":"1.0.0","query_logs":"1.0.0","query_metrics":"1.0.0","query_traces":"1.0.0"}},"schema_version":"1.0","track":"recovery-safety"}
